{
  "components": [
    {
      "imageDigest": "sha256:aaaaaaaaaaaaaaaaaaaaaaaaaaaaaaaaaaaaaaaaaaaaaaaaaaaaaaaaaaaaaaaa",
      "imageRepository": "ghcr.io/example/contabilidade-automation-worker",
      "name": "automation-worker",
      "provenanceSha256": "aaaaaaaaaaaaaaaaaaaaaaaaaaaaaaaaaaaaaaaaaaaaaaaaaaaaaaaaaaaaaaaa",
      "sbomSha256": "aaaaaaaaaaaaaaaaaaaaaaaaaaaaaaaaaaaaaaaaaaaaaaaaaaaaaaaaaaaaaaaa"
    },
    {
      "imageDigest": "sha256:aaaaaaaaaaaaaaaaaaaaaaaaaaaaaaaaaaaaaaaaaaaaaaaaaaaaaaaaaaaaaaaa",
      "imageRepository": "ghcr.io/example/contabilidade-backend",
      "name": "backend",
      "provenanceSha256": "aaaaaaaaaaaaaaaaaaaaaaaaaaaaaaaaaaaaaaaaaaaaaaaaaaaaaaaaaaaaaaaa",
      "sbomSha256": "aaaaaaaaaaaaaaaaaaaaaaaaaaaaaaaaaaaaaaaaaaaaaaaaaaaaaaaaaaaaaaaa"
    },
    {
      "imageDigest": "sha256:aaaaaaaaaaaaaaaaaaaaaaaaaaaaaaaaaaaaaaaaaaaaaaaaaaaaaaaaaaaaaaaa",
      "imageRepository": "ghcr.io/example/contabilidade-frontend",
      "name": "frontend",
      "provenanceSha256": "aaaaaaaaaaaaaaaaaaaaaaaaaaaaaaaaaaaaaaaaaaaaaaaaaaaaaaaaaaaaaaaa",
      "sbomSha256": "aaaaaaaaaaaaaaaaaaaaaaaaaaaaaaaaaaaaaaaaaaaaaaaaaaaaaaaaaaaaaaaa"
    }
  ],
  "createdAt": "2026-08-17T00:00:00Z",
  "evidenceIds": [
    "EVID-STR-REL-003"
  ],
  "exception": {
    "expiresAt": "2026-08-16T00:00:00Z",
    "owner": "release-owner",
    "reason": "emergency recovery",
    "transition": "production->development"
  },
  "flywayFrontier": 12,
  "gitCommit": "1111111111111111111111111111111111111111",
  "releaseVersion": "0.5.1",
  "rollbackTarget": {
    "flywayFrontier": 12,
    "gitCommit": "2222222222222222222222222222222222222222",
    "releaseVersion": "0.5.0"
  },
  "sourceEnvironment": "production",
  "targetEnvironment": "development"
}
